{
  "schema_version": "tobac.observation-handoff.v1",
  "target_scope": {
    "geography": "NZ_national",
    "population": "prospective retailer catchment population; selection unresolved",
    "start": "2026-01-01",
    "end": "2027-01-01",
    "unit": "cigarette_equivalents/year"
  },
  "target_products": "factory_made_and_RYO_at_source_0.7g_convention",
  "used_data_ids": [],
  "dependency_mappings": {
    "NZ_MOH_tobacco_returns": [
      "NZ_MOH_tobacco_returns"
    ],
    "NZHS + MOH returns + fixed uplift assumption": [
      "NZ_MOH_tobacco_returns",
      "NZHS"
    ]
  },
  "observations": [
    {
      "observation_id": "releases-2010",
      "path": "data/longitudinal_20261024/nz_tobacco_release_tonnes_2010_2025.csv",
      "collection": "evidence/longitudinal/references.csl.json",
      "source_id": "long-nz-tobacco-tonnes-2025",
      "year": 2010,
      "period_start": "2010-01-01",
      "period_end": "2011-01-01",
      "role": "observation",
      "source_scope": null,
      "products": "reported_smoked_tobacco_mass_excluding_cigars_cigarillos; other product/channel definitions unresolved",
      "likelihood_model": null,
      "covariance_model": null,
      "transport_model": null
    },
    {
      "observation_id": "releases-2011",
      "path": "data/longitudinal_20261024/nz_tobacco_release_tonnes_2010_2025.csv",
      "collection": "evidence/longitudinal/references.csl.json",
      "source_id": "long-nz-tobacco-tonnes-2025",
      "year": 2011,
      "period_start": "2011-01-01",
      "period_end": "2012-01-01",
      "role": "observation",
      "source_scope": null,
      "products": "reported_smoked_tobacco_mass_excluding_cigars_cigarillos; other product/channel definitions unresolved",
      "likelihood_model": null,
      "covariance_model": null,
      "transport_model": null
    },
    {
      "observation_id": "releases-2012",
      "path": "data/longitudinal_20261024/nz_tobacco_release_tonnes_2010_2025.csv",
      "collection": "evidence/longitudinal/references.csl.json",
      "source_id": "long-nz-tobacco-tonnes-2025",
      "year": 2012,
      "period_start": "2012-01-01",
      "period_end": "2013-01-01",
      "role": "observation",
      "source_scope": null,
      "products": "reported_smoked_tobacco_mass_excluding_cigars_cigarillos; other product/channel definitions unresolved",
      "likelihood_model": null,
      "covariance_model": null,
      "transport_model": null
    },
    {
      "observation_id": "releases-2013",
      "path": "data/longitudinal_20261024/nz_tobacco_release_tonnes_2010_2025.csv",
      "collection": "evidence/longitudinal/references.csl.json",
      "source_id": "long-nz-tobacco-tonnes-2025",
      "year": 2013,
      "period_start": "2013-01-01",
      "period_end": "2014-01-01",
      "role": "observation",
      "source_scope": null,
      "products": "reported_smoked_tobacco_mass_excluding_cigars_cigarillos; other product/channel definitions unresolved",
      "likelihood_model": null,
      "covariance_model": null,
      "transport_model": null
    },
    {
      "observation_id": "releases-2014",
      "path": "data/longitudinal_20261024/nz_tobacco_release_tonnes_2010_2025.csv",
      "collection": "evidence/longitudinal/references.csl.json",
      "source_id": "long-nz-tobacco-tonnes-2025",
      "year": 2014,
      "period_start": "2014-01-01",
      "period_end": "2015-01-01",
      "role": "observation",
      "source_scope": null,
      "products": "reported_smoked_tobacco_mass_excluding_cigars_cigarillos; other product/channel definitions unresolved",
      "likelihood_model": null,
      "covariance_model": null,
      "transport_model": null
    },
    {
      "observation_id": "releases-2015",
      "path": "data/longitudinal_20261024/nz_tobacco_release_tonnes_2010_2025.csv",
      "collection": "evidence/longitudinal/references.csl.json",
      "source_id": "long-nz-tobacco-tonnes-2025",
      "year": 2015,
      "period_start": "2015-01-01",
      "period_end": "2016-01-01",
      "role": "observation",
      "source_scope": null,
      "products": "reported_smoked_tobacco_mass_excluding_cigars_cigarillos; other product/channel definitions unresolved",
      "likelihood_model": null,
      "covariance_model": null,
      "transport_model": null
    },
    {
      "observation_id": "releases-2016",
      "path": "data/longitudinal_20261024/nz_tobacco_release_tonnes_2010_2025.csv",
      "collection": "evidence/longitudinal/references.csl.json",
      "source_id": "long-nz-tobacco-tonnes-2025",
      "year": 2016,
      "period_start": "2016-01-01",
      "period_end": "2017-01-01",
      "role": "observation",
      "source_scope": null,
      "products": "reported_smoked_tobacco_mass_excluding_cigars_cigarillos; other product/channel definitions unresolved",
      "likelihood_model": null,
      "covariance_model": null,
      "transport_model": null
    },
    {
      "observation_id": "releases-2017",
      "path": "data/longitudinal_20261024/nz_tobacco_release_tonnes_2010_2025.csv",
      "collection": "evidence/longitudinal/references.csl.json",
      "source_id": "long-nz-tobacco-tonnes-2025",
      "year": 2017,
      "period_start": "2017-01-01",
      "period_end": "2018-01-01",
      "role": "observation",
      "source_scope": null,
      "products": "reported_smoked_tobacco_mass_excluding_cigars_cigarillos; other product/channel definitions unresolved",
      "likelihood_model": null,
      "covariance_model": null,
      "transport_model": null
    },
    {
      "observation_id": "releases-2018",
      "path": "data/longitudinal_20261024/nz_tobacco_release_tonnes_2010_2025.csv",
      "collection": "evidence/longitudinal/references.csl.json",
      "source_id": "long-nz-tobacco-tonnes-2025",
      "year": 2018,
      "period_start": "2018-01-01",
      "period_end": "2019-01-01",
      "role": "observation",
      "source_scope": null,
      "products": "reported_smoked_tobacco_mass_excluding_cigars_cigarillos; other product/channel definitions unresolved",
      "likelihood_model": null,
      "covariance_model": null,
      "transport_model": null
    },
    {
      "observation_id": "releases-2019",
      "path": "data/longitudinal_20261024/nz_tobacco_release_tonnes_2010_2025.csv",
      "collection": "evidence/longitudinal/references.csl.json",
      "source_id": "long-nz-tobacco-tonnes-2025",
      "year": 2019,
      "period_start": "2019-01-01",
      "period_end": "2020-01-01",
      "role": "observation",
      "source_scope": null,
      "products": "reported_smoked_tobacco_mass_excluding_cigars_cigarillos; other product/channel definitions unresolved",
      "likelihood_model": null,
      "covariance_model": null,
      "transport_model": null
    },
    {
      "observation_id": "releases-2020",
      "path": "data/longitudinal_20261024/nz_tobacco_release_tonnes_2010_2025.csv",
      "collection": "evidence/longitudinal/references.csl.json",
      "source_id": "long-nz-tobacco-tonnes-2025",
      "year": 2020,
      "period_start": "2020-01-01",
      "period_end": "2021-01-01",
      "role": "observation",
      "source_scope": null,
      "products": "reported_smoked_tobacco_mass_excluding_cigars_cigarillos; other product/channel definitions unresolved",
      "likelihood_model": null,
      "covariance_model": null,
      "transport_model": null
    },
    {
      "observation_id": "releases-2021",
      "path": "data/longitudinal_20261024/nz_tobacco_release_tonnes_2010_2025.csv",
      "collection": "evidence/longitudinal/references.csl.json",
      "source_id": "long-nz-tobacco-tonnes-2025",
      "year": 2021,
      "period_start": "2021-01-01",
      "period_end": "2022-01-01",
      "role": "observation",
      "source_scope": null,
      "products": "reported_smoked_tobacco_mass_excluding_cigars_cigarillos; other product/channel definitions unresolved",
      "likelihood_model": null,
      "covariance_model": null,
      "transport_model": null
    },
    {
      "observation_id": "releases-2022",
      "path": "data/longitudinal_20261024/nz_tobacco_release_tonnes_2010_2025.csv",
      "collection": "evidence/longitudinal/references.csl.json",
      "source_id": "long-nz-tobacco-tonnes-2025",
      "year": 2022,
      "period_start": "2022-01-01",
      "period_end": "2023-01-01",
      "role": "observation",
      "source_scope": null,
      "products": "reported_smoked_tobacco_mass_excluding_cigars_cigarillos; other product/channel definitions unresolved",
      "likelihood_model": null,
      "covariance_model": null,
      "transport_model": null
    },
    {
      "observation_id": "releases-2023",
      "path": "data/longitudinal_20261024/nz_tobacco_release_tonnes_2010_2025.csv",
      "collection": "evidence/longitudinal/references.csl.json",
      "source_id": "long-nz-tobacco-tonnes-2025",
      "year": 2023,
      "period_start": "2023-01-01",
      "period_end": "2024-01-01",
      "role": "observation",
      "source_scope": null,
      "products": "reported_smoked_tobacco_mass_excluding_cigars_cigarillos; other product/channel definitions unresolved",
      "likelihood_model": null,
      "covariance_model": null,
      "transport_model": null
    },
    {
      "observation_id": "releases-2024",
      "path": "data/longitudinal_20261024/nz_tobacco_release_tonnes_2010_2025.csv",
      "collection": "evidence/longitudinal/references.csl.json",
      "source_id": "long-nz-tobacco-tonnes-2025",
      "year": 2024,
      "period_start": "2024-01-01",
      "period_end": "2025-01-01",
      "role": "observation",
      "source_scope": null,
      "products": "reported_smoked_tobacco_mass_excluding_cigars_cigarillos; other product/channel definitions unresolved",
      "likelihood_model": null,
      "covariance_model": null,
      "transport_model": null
    },
    {
      "observation_id": "releases-2025",